Rank,University,Faculty,Title,Research,Website,Email,Status,is_chinese,send_priority,full_research,publications
13,Columbia University,Charles A. Zukowski,Professor,Integrated Circuits,https://www.ee.columbia.edu/content/charles-zukowski,,,False,4,"Integrated Circuits and Systems, Computer Engineering and Computer Systems","Title: Efficient and high-performance clocking circuits for high-speed data links, Authors: Z Wang, Year: 2022, Source: https://search.proquest.com/openview/a3e4010c8f519f25c3624a4d0e6cd39c/1?pq-origsite=gscholar&cbl=18750&diss=y | Title: Kinematic space and the orbit method, Authors: RF Penna, C Zukowski, Year: 2019, Source: https://link.springer.com/article/10.1007/JHEP07(2019)045 | Title: Ephemeral Literature and Liberties: Early American Periodicals and the Development of American Identities, Authors: S Zukowski, Year: 2018, Source: https://search.proquest.com/openview/202ef8e8e18421c8ddcf46ce835b88ea/1?pq-origsite=gscholar&cbl=18750 | Title: Archives, (Inter)Mediality, and the Graphic Novel: Ghost River as an Indigenous Revision of Records, Authors: S Zukowski, Year: 2023, Source: https://www.euppublishing.com/doi/abs/10.3366/tna.2023.0006 | Title: Walt Whitman, Trinity Church, and Antebellum Reprint Culture, Authors: S Zukowski, Year: 2020, Source: https://pubs.lib.uiowa.edu/wwqr/article/id/26271/download/pdf/ | Title: Design of power-efficient optical transceivers and design of high-linearity wireless wideband receivers, Authors: Y Zhang, Year: 2021, Source: https://search.proquest.com/openview/a52e634990441c32bdab12f1ee8ec233/1?pq-origsite=gscholar&cbl=18750&diss=y | Title: The Marianists' History of the Evolution of UD's Center for Christian Renewal, the Institute for Pastoral Initiatives and Contribution to the Mission of the Catholic Church …, Authors: AA Zukowski, Year: 2023, Source: https://ecommons.udayton.edu/ipi_doc/2/ | Title: Algorithm and Hardware Co-Design for Local/Edge Computing, Authors: Z Jiang, Year: 2020, Source: https://search.proquest.com/openview/8b85e9f9f6e85eebcc305d9586efbeb0/1?pq-origsite=gscholar&cbl=18750&diss=y | Title: Switched-Capacitor RF Receivers for High Interferer Tolerance, Authors: Y Xu, Year: 2018, Source: https://search.proquest.com/openview/da7f5afeb359538d97d03bff99faf905/1?pq-origsite=gscholar&cbl=18750 | Title: Use of Monotonic Static Logic in Scaled, Leaky CMOS Technologies, Authors: K Irez, Year: 2015, Source: https://search.proquest.com/openview/1f955351b06756dccefbc2f0e12b2cfc/1?pq-origsite=gscholar&cbl=18750"
13,Columbia University,Richard M. Osgood Jr.,Professor,"Photonics, Integrated Photonics",,,,False,4,"Optical Physics, Surface Physics and Chemistry, Electronic Materials, Photonics, Integrated Photonics","Title: A 60 Gb/s MDM-WDM Si photonic link with< 0.7 dB power penalty per channel, Authors: …, JI Dadap, A Stein, M Lu, K Bergman, RM Osgood Jr, Year: 2014, Source: https://opg.optica.org/abstract.cfm?uri=oe-22-15-18543 | Title: Numerical surface-corrected nonlocal electrodynamic model for nanophotonic structures, Authors: …, X Meng, S Wu, JI Dadap, RM Osgood Jr, Year: 2018, Source: https://opg.optica.org/abstract.cfm?uri=josab-35-6-1442 | Title: Extrinsic photodiodes for integrated mid-infrared silicon photonics, Authors: …, K Bergman, H Bahkru, WMJ Green, RM Osgood Jr, Year: 2014, Source: https://opg.optica.org/abstract.cfm?uri=optica-1-4-264 | Title: Historical diets of forage fish and juvenile pacific salmon in the strait of Georgia, 1966–1968, Authors: GJ Osgood, LA Kennedy, JJ Holden…, Year: 2016, Source: https://www.tandfonline.com/doi/abs/10.1080/19425120.2016.1223231 | Title: Principles of Photonic Integrated Circuits, Authors: R Osgood Jr, X Meng, Year: 2021, Source: https://link.springer.com/content/pdf/10.1007/978-3-030-65193-0.pdf | Title: Musings and Silences of Chief Justice William Osgoode: Digest Marginalia about the Reception of Imperial Law, Authors: GB Baker, Year: 2016, Source: https://heinonline.org/hol-cgi-bin/get_pdf.cgi?handle=hein.journals/ohlj54&section=33 | Title: Limited war revisited, Authors: RE Osgood, Year: 2019, Source: https://www.taylorfrancis.com/books/mono/10.4324/9780429051180/limited-war-revisited-robert-osgood | Title: The charmed life of superstar exporters: Survey evidence on firms and trade policy, Authors: I Osgood, D Tingley, T Bernauer, IS Kim…, Year: 2017, Source: https://www.journals.uchicago.edu/doi/abs/10.1086/687207 | Title: General Introduction to Coupled-Mode Theory, Authors: R Osgood jr, X Meng, Year: 2021, Source: https://link.springer.com/chapter/10.1007/978-3-030-65193-0_5 | Title: Dynamic Studies of Photo-and Electron-Induced Reactions on Nanostructured Surfaces, Authors: R Osgood Jr, Year: 2018, Source: https://www.osti.gov/biblio/1467566"
13,Columbia University,Ioannis (John) Kymissis,Professor,optoelectronic devices,http://kymissis.columbia.edu/people.html,kymissis@columbia.edu,,False,4,"Thin film devices and systems, optoelectronic and sensing devices based on organic and amorphous metal oxide thin film materials, device performance, fabrication, packaging, and device driving.","Title: Project-based learning within a large-scale interdisciplinary research effort, Authors: …, M Gorlatova, J Sarik, P Kinget, I Kymissis…, Year: 2014, Source: https://arxiv.org/abs/1410.6935 | Title: A laboratory course on information display technologies for remote learning, Authors: …, V Kumar, ZA Lamport, I Kymissis, Year: 2021, Source: https://sid.onlinelibrary.wiley.com/doi/abs/10.1002/jsid.1000 | Title: Employing pneumatic nozzle printing for controlling the crystal growth of small molecule organic semiconductor for field‐effect transistors, Authors: …, Y Bonnassieux, J Anthony, I Kymissis, Year: 2018, Source: https://onlinelibrary.wiley.com/doi/abs/10.1002/aelm.201700534 | Title: Strongly Correlated Alignment of Fluorinated 5, 11‐Bis (triethylgermylethynyl) anthradithiophene Crystallites in Solution‐Processed Field‐Effect Transistors, Authors: …, G Horowitz, JE Anthony, I Kymissis, Year: 2014, Source: https://chemistry-europe.onlinelibrary.wiley.com/doi/abs/10.1002/cphc.201402360 | Title: Difluorinated 6, 13‐Bis (triisopropylsilylethynyl) pentacene: Synthesis, Crystallinity, and Charge‐Transport Properties, Authors: …, MM Payne, SR Parkin, JE Anthony, I Kymissis, Year: 2015, Source: https://chemistry-europe.onlinelibrary.wiley.com/doi/abs/10.1002/cphc.201402750 | Title: A Pvdf-Trfe Intracochlear Hydrophone and Amplifier For Totally Implantable Cochlear Implants, Authors: …, HH Nakajima, JH Lang, I Kymissis…, Year: 2022, Source: https://ieeexplore.ieee.org/abstract/document/9699808/ | Title: A Dense Conformal Electrode Array for High Spatial Resolution Stimulation of Electrosensory Systems, Authors: …, SM Thompson, NB Sawtell, I Kymissis, Year: 2023, Source: https://onlinelibrary.wiley.com/doi/abs/10.1002/admt.202200354 | Title: Ultra‐Thin Ceramic Substrates for Improved Heat sinking for MicroLEDs, Authors: …, M Noga, Z Lamport, I Kymissis, Year: 2023, Source: https://onlinelibrary.wiley.com/doi/abs/10.1002/admt.202300390 | Title: An active‐matrix microLED display based on monolithic integration with IGZO backplane, Authors: …, R Alshanbari, M Noga, I Kymissis, Year: 2024, Source: https://sid.onlinelibrary.wiley.com/doi/abs/10.1002/jsid.1299 | Title: Large Area Flexible Organic Field‐effect Transistor Fabrication, Authors: …, MR Cavallari, I Kymissis, Year: 2023, Source: https://onlinelibrary.wiley.com/doi/abs/10.1002/9781118751077.ch4"
13,Columbia University,Keren Bergman,Professor,"silicon photonics, optical interconnects",http://lightwave.ee.columbia.edu/,bergman@ee.columbia.edu,,False,4,"Nano-photonics, optical interconnects for low power, high bandwidth computing applications, silicon photonics, optical interconnection networks for advanced computing systems, data centers, optical packet-switched routers, and chip multiprocessor nanophotonic networks-on-chip.","Title: Massively scalable Kerr comb-driven silicon photonic link, Authors: …, Q Cheng, M Lipson, AL Gaeta, K Bergman, Year: 2023, Source: https://www.nature.com/articles/s41566-023-01244-7 | Title: Petabit-scale silicon photonic interconnects with integrated kerr frequency combs, Authors: …, M Lipson, A Gaeta, K Bergman, Year: 2022, Source: https://ieeexplore.ieee.org/abstract/document/9852657/ | Title: Multi-stage 8× 8 silicon photonic switch based on dual-microring switching elements, Authors: …, M Hochberg, K Bergman, Year: 2019, Source: https://ieeexplore.ieee.org/abstract/document/8861317/ | Title: PINE: photonic integrated networked energy efficient datacenters (ENLITENED program), Authors: …, J Bowers, A Gaeta, M Lipson, K Bergman, Year: 2020, Source: https://opg.optica.org/abstract.cfm?uri=jocn-12-12-443 | Title: Integrated Kerr frequency comb-driven silicon photonic transmitter, Authors: …, Q Cheng, M Lipson, AL Gaeta, K Bergman, Year: 2021, Source: https://arxiv.org/abs/2109.10297 | Title: Fabrication-robust silicon photonic devices in standard sub-micron silicon-on-insulator processes, Authors: …, SP Roberts, A James, M Lipson, K Bergman, Year: 2023, Source: https://opg.optica.org/abstract.cfm?uri=ol-48-2-215 | Title: Silicon photonics for exascale systems, Authors: …, R Hendry, Q Li, D Calhoun, K Bergman, Year: 2015, Source: https://opg.optica.org/abstract.cfm?uri=jlt-33-3-547 | Title: Photonic network-on-chip design, Authors: K Bergman, LP Carloni, A Biberman, J Chan, G Hendry, Year: 2014, Source: https://link.springer.com/content/pdf/10.1007/978-1-4419-9335-9.pdf | Title: Application of a Digital Test Core to a Test Bed for Bit-Parallel Optoelectronic Communications, Authors: K Bergman, Year: None, Source: https://citeseerx.ist.psu.edu/document?repid=rep1&type=pdf&doi=b3680699b6d034f47204870b32ed0a5c6121c680 | Title: Data Movement Dominates: Advanced Memory Technology to Address the Real Exascale Power Problem, Authors: K Bergman, Year: 2014, Source: https://www.osti.gov/biblio/1151423"
14,University of Michigan-Ann Arbor,Shuai Liu,Professor,Quantum Optics,,,,True,2,"Integrated Photonics, Nanofabrication, Nonlinear Optics, and Quantum Optics","Title: Driver lines for studying associative learning in Drosophila, Authors: Y Shuai, M Sammons, G Sterne, K Hibbard, H Yang…, Year: 2024, Source: https://elifesciences.org/reviewed-preprints/94168 | Title: Neural network filter quantized control for a class of nonlinear systems with input and state quantization, Authors: S Sui, Z Liu, W Bi, S Tong…, Year: 2023, Source: https://ieeexplore.ieee.org/abstract/document/10322656/ | Title: Is the tropical cyclone surge in Shanghai more sensitive to landfall location or intensity change?, Authors: S Wang, R Toumi, Q Ye, Q Ke, J Bricker…, Year: 2021, Source: https://rmets.onlinelibrary.wiley.com/doi/abs/10.1002/asl.1058 | Title: A novel redox modulator induces a GPX4-mediated cell death that is dependent on iron and reactive oxygen species, Authors: S Hu, M Sechi, PK Singh, L Dai…, Year: 2020, Source: https://pubs.acs.org/doi/abs/10.1021/acs.jmedchem.0c01016 | Title: Dynamic changes in biofilm structures under dynamic flow conditions, Authors: …, H Zhu, G Zheng, F Dong, C Liu, Year: 2022, Source: https://journals.asm.org/doi/abs/10.1128/aem.01072-22 | Title: Formation of Quasi-Bound States in the Continuum in a Single Deformed Microcavity, Authors: S Liu, BH Wu, J Huang, Z Zhang, Year: 2409, Source: https://arxiv.org/abs/2409.00201 | Title: Improvement in renal function in patients with multiple myeloma and impaired renal function receiving novel agent induction therapies, Authors: …, NA Rahman, J Schwartz, G Blumenthal, Q Liu, Year: 2020, Source: https://aacrjournals.org/cancerres/article-abstract/80/16_Supplement/587/644267 | Title: UNDER THE SAME ROOF: GRANDPARENTAL CO-RESIDENCE AND CO-PARENTING PATTERNS IN MODERN CHINESE FAMILIES, Authors: S Zhou, C Liu, X Bai, Year: 2022, Source: https://academic.oup.com/innovateage/article-abstract/6/Supplement_1/52/6938138 | Title: Molten Salt Pump Journal-Bearings Dynamic Characteristics Under Hydrodynamic Lubrication Conditions, Authors: M Chen, S Che, A Burak, Year: 2024, Source: https://asmedigitalcollection.asme.org/nuclearengineering/article-pdf/10/3/030908/7252785/ners_010_03_030908.pdf | Title: State-Observer-Based Event-Trigger Bipartite Consensus Secure Control for NMASs with Deception Attacks, Authors: S Sui, D Shen, S Tong…, Year: 2024, Source: https://ieeexplore.ieee.org/abstract/document/10618996/"
14,University of Michigan-Ann Arbor,Hui Deng,Professor,Optical,https://sites.lsa.umich.edu/deng-lab/,dengh@umich.edu,,True,2,"Experimental Condensed Matter Physics; Physics; Atomic, Molecular & Optical","Title: Polariton-polariton interaction beyond the Born approximation: A toy model study, Authors: H Hu, H Deng, XJ Liu, Year: 2020, Source: https://journals.aps.org/pra/abstract/10.1103/PhysRevA.102.063305 | Title: Dispersion engineering for vertical microcavities using subwavelength gratings, Authors: Z Wang, B Zhang, H Deng, Year: 2015, Source: https://journals.aps.org/prl/abstract/10.1103/PhysRevLett.114.073601 | Title: Physics and Applications of High‐β Micro‐and Nanolasers, Authors: H Deng, GL Lippi, J Mørk, J Wiersig…, Year: 2021, Source: https://onlinelibrary.wiley.com/doi/abs/10.1002/adom.202100415 | Title: Direct generation of radially polarized vector vortex beam with an exciton-polariton laser, Authors: J Hu, S Kim, C Schneider, S Höfling, H Deng, Year: 2020, Source: https://journals.aps.org/prapplied/abstract/10.1103/PhysRevApplied.14.044001 | Title: Interlayer exciton laser of extended spatial coherence in atomically thin heterostructures, Authors: EY Paik, L Zhang, GW Burg, R Gogna, E Tutuc, H Deng, Year: 2019, Source: https://www.nature.com/articles/s41586-019-1779-x | Title: Monolithic high-contrast grating based polariton laser, Authors: …, S Brodbeck, C Schneider, S Höfling, H Deng, Year: 2018, Source: https://pubs.acs.org/doi/abs/10.1021/acsphotonics.8b01141 | Title: Van der Waals heterostructure polaritons with moiré-induced nonlinearity, Authors: …, K Watanabe, T Taniguchi, SR Forrest, H Deng, Year: 2021, Source: https://www.nature.com/articles/s41586-021-03228-5. | Title: Macroscopic transition metal dichalcogenides monolayers with uniformly high optical quality, Authors: …, B Liu, H Sun, Y Lu, R Wang, S Forrest, H Deng, Year: 2023, Source: https://www.nature.com/articles/s41467-023-37500-1 | Title: Zero-dimensional polariton laser in a subwavelength grating-based vertical microcavity, Authors: …, C Schneider, M Kamp, S Höfling, H Deng, Year: 2014, Source: https://www.nature.com/articles/lsa201416 | Title: Abstract P27: Proteogenomic and metabolomic analysis of acute myeloid leukemia reveals molecular and functional underpinnings of cellular and clinical phenotypes, Authors: SC Alec Chu, Y Hsiao, Y Deng, C Wang, J Kyle…, Year: 2024, Source: https://aacrjournals.org/bloodcancerdiscov/article/5/2_Supplement/P27/734824"
14,University of Michigan-Ann Arbor,Bin Liu,Professor,Photonic and optoelectronic devices,,,,True,2,Photonic and optoelectronic devices based on nanoscale materials and geometries,"Title: Long-range propagation of exciton-polaritons in large-area 2D semiconductor monolayers, Authors: B Liu, J Lynch, H Zhao, BR Conran, C McAleese…, Year: 2023, Source: https://pubs.acs.org/doi/abs/10.1021/acsnano.3c03485 | Title: SRA regulates adipogenesis by modulating p38/JNK phosphorylation and stimulating insulin receptor gene expression and downstream signaling, Authors: S Liu, R Xu, I Gerin, WP Cawthorn, OA MacDougald…, Year: 2014, Source: https://journals.plos.org/plosone/article?id=10.1371/journal.pone.0095416 | Title: Genetic ablation of ryanodine receptor 2 phosphorylation at Ser‐2808 aggravates Ca2+‐dependent cardiomyopathy by exacerbating diastolic Ca2+ release, Authors: B Liu, HT Ho, F Velez‐Cortes, Q Lou…, Year: 2014, Source: https://physoc.onlinelibrary.wiley.com/doi/abs/10.1113/jphysiol.2013.264689 | Title: Guided Bloch Surface Wave Polaritons on Patterned Distributed Bragg Reflectors at Room Temperature, Authors: B Liu, J Horowitz, SR Forrest, Year: 2023, Source: https://pubs.acs.org/doi/abs/10.1021/acsphotonics.3c01351 | Title: Bursting translation of single mRNAS in live cells, Authors: NM Livingston, J Kwon, O Valera, P Reddy, J Liu…, Year: 2022, Source: https://www.cell.com/biophysj/fulltext/S0006-3495(21)02701-6 | Title: Photocurrent generation following long-range propagation of organic exciton–polaritons, Authors: B Liu, X Huang, S Hou, D Fan, SR Forrest, Year: 2022, Source: https://opg.optica.org/abstract.cfm?uri=optica-9-9-1029 | Title: Structural insight into Escherichia coli CsgA amyloid fibril assembly, Authors: F Bu, DR Dee, B Liu, Year: 2024, Source: https://journals.asm.org/doi/abs/10.1128/mbio.00419-24 | Title: The electron accelerator driven sub-critical system, Authors: B Liu, X Zhang, F Liu, W Dou, J Wang, Year: 2022, Source: https://www.sciencedirect.com/science/article/pii/S0029549321005197 | Title: Ultrafast Dynamics of Bloch Surface Wave Polaritons in Large‐Area 2D Semiconductor Monolayers at Room Temperature, Authors: B Liu, E Michail, G He, MY Sfeir…, Year: 2024, Source: https://onlinelibrary.wiley.com/doi/abs/10.1002/adma.202404286 | Title: Extension and long-range contacts drive chromatin clutches and aggregates, Authors: S Liu, X Lin, B Zhang, Year: 2023, Source: https://www.cell.com/biophysj/fulltext/S0006-3495(22)03550-0"
14,University of Michigan-Ann Arbor,Kai Sun,Professor,"Topological states of matter, Strongly correlated systems",https://sites.lsa.umich.edu/kai-sun/,sunkai@umich.edu,,True,2,"Theoretical Condensed Matter Physics, Foundations of Physics, Applied Physics Program, Topological states of matter, Strongly correlated systems","Title: Strain-induced formation of self-assembled InGaN/GaN superlattices in nominal InGaN films grown by plasma-assisted molecular beam epitaxy, Authors: K Khan, K Sun, C Wurm, K Datta, PB Deotare…, Year: 2021, Source: https://journals.aps.org/prmaterials/abstract/10.1103/PhysRevMaterials.5.124606 | Title: Integral algorithm of exponential observables for interacting fermions in quantum Monte Carlo simulations, Authors: X Zhang, G Pan, BB Chen, K Sun, ZY Meng, Year: 2024, Source: https://journals.aps.org/prb/abstract/10.1103/PhysRevB.109.205147 | Title: Continuum theory for topological edge soft modes, Authors: K Sun, X Mao, Year: 2020, Source: https://journals.aps.org/prl/abstract/10.1103/PhysRevLett.124.207601 | Title: Chemical modification in and on single phase [NiO]0.5[Al2O3]0.5 nanopowders produces “chocolate chip‐like” Nix@[NiO]0.5‐x[Al2O3]0.5 nanocomposite …, Authors: F Wang, K Sun, E Yi, RM Laine, Year: 2019, Source: https://ceramics.onlinelibrary.wiley.com/doi/abs/10.1111/jace.16632 | Title: Rationalizing Euclidean Assemblies of Hard Polyhedra from Tessellations in Curved Space, Authors: PWA Schönhöfer, K Sun, X Mao, SC Glotzer, Year: 2023, Source: https://journals.aps.org/prl/abstract/10.1103/PhysRevLett.131.258201 | Title: Maxwell plates and phonon fractionalization, Authors: K Sun, X Mao, Year: 1907, Source: https://arxiv.org/abs/1907.06620 | Title: An optimization-oriented supervisory controller design for hybrid fuel cell electrified vehicles, Authors: …, A Albousefi, M Kuang, J Sun, Year: 2018, Source: https://asmedigitalcollection.asme.org/DSCC/proceedings-abstract/DSCC2018/V001T09A003/455574 | Title: Fractional excitations in non-Euclidean elastic plates, Authors: K Sun, X Mao, Year: 2021, Source: https://journals.aps.org/prl/abstract/10.1103/PhysRevLett.127.098001 | Title: Algebraic non-Hermitian skin effect and unified non-Bloch band theory in arbitrary dimensions, Authors: K Zhang, C Shu, K Sun, Year: 2406, Source: https://arxiv.org/abs/2406.06682 | Title: A synthetic biology platform for the reconstitution and mechanistic dissection of LINC complex assembly (103/120 characters), Authors: S Majumder, PT Willey, MS DeNies, AP Liu…, Year: 2018, Source: https://www.researchgate.net/profile/Gw-Luxton-2/publication/327918824_A_synthetic_biology_platform_for_the_reconstitution_and_mechanistic_dissection_of_LINC_complex_assembly/links/5bb24f7ba6fdccd3cb812258/A-synthetic-biology-platform-for-the-reconstitution-and-mechanistic-dissection-of-LINC-complex-assembly.pdf"
14,University of Michigan-Ann Arbor,Pei-Cheng Ku,Professor,"semiconductor light sources, integrated photonics",,peicheng@umich.edu,,True,2,"Optoelectronic devices and materials with current focus on integrated photonics, semiconductor light sources (both classical and quantum) and their applications.","Title: Low-profile shear force tactile sensor based on optical methods, Authors: NA Dvořák, PC Ku, Year: 2022, Source: https://ieeexplore.ieee.org/abstract/document/9771450/ | Title: Strain effects in gallium nitride adsorption on defective and doped graphene: First-principles calculations, Authors: H Yan, PC Ku, ZY Gan, S Liu, P Li, Year: 2018, Source: https://www.mdpi.com/2073-4352/8/2/58 | Title: Handbook of GaN semiconductor materials and devices, Authors: WW Bi, HH Kuo, P Ku, B Shen, Year: 2017, Source: https://books.google.com/books?hl=en&lr=lang_en&id=RjwPEAAAQBAJ&oi=fnd&pg=PP1&dq=Pei-Cheng+Ku+University+of+Michigan-Ann+Arbor&ots=UexIQrhZCX&sig=jhj2k1YvlNQvtorKLbLsTXIiNvY | Title: Integrated parabolic nanolenses on MicroLED color pixels, Authors: …, K Chung, A Katcher, J Sui, H Deng, PC Ku, Year: 2018, Source: https://iopscience.iop.org/article/10.1088/1361-6528/aaac5f/meta | Title: Led lights with hidden intensity-modulated blue channels aiming for enhanced subconscious visual responses, Authors: G Vartanian, KY Wong, PC Ku, Year: 2017, Source: https://ieeexplore.ieee.org/abstract/document/7914671/ | Title: Plasmonic enhancement of single photon emission from a site-controlled quantum dot, Authors: …, TA Hill, CH Teng, L Zhang, H Deng, PC Ku, Year: 2015, Source: https://pubs.acs.org/doi/abs/10.1021/acsphotonics.5b00086 | Title: Two-photon controlled-phase gates enabled by photonic dimers, Authors: Z Chen, Y Zhou, JT Shen, PC Ku, D Steel, Year: 2021, Source: https://journals.aps.org/pra/abstract/10.1103/PhysRevA.103.052610 | Title: Chip-scale Integration of RGB LED Pixels for Microdisplay, Lighting and Biophotonics Applications, Authors: PC Ku, Year: 2017, Source: https://opg.optica.org/abstract.cfm?uri=AIO-2017-AM3A.2 | Title: Sim2Real in Reconstructive Spectroscopy: Deep Learning with Augmented Device-Informed Data Simulation, Authors: J Chen, P Li, Y Wang, PC Ku, Q Qu, Year: 2403, Source: https://arxiv.org/abs/2403.12354 | Title: GaN Optoelectronic Devices Based on Local Strain Engineering, Authors: P Ku, Year: 2020, Source: https://iopscience.iop.org/article/10.1149/09805.0415ecst/meta"
14,University of Michigan-Ann Arbor,Di Liang,Professor,"Semiconductor optoelectronics, photonic devices",https://lsip.engin.umich.edu/,liangdi@umich.edu,,True,2,"Semiconductor optoelectronics, compound semiconductor and silicon-based photonic devices, large-scale photonic integration for optical interconnect, sensing, and computing.","Title: De novo loss-of-function KCNMA1 variants are associated with a new multiple malformation syndrome and a broad spectrum of developmental and neurological …, Authors: L Liang, X Li, S Moutton…, Year: 2019, Source: https://academic.oup.com/hmg/article-abstract/28/17/2937/5506556 | Title: Proteogenomic characterization reveals therapeutic vulnerabilities in lung adenocarcinoma, Authors: …, SV Vasaikar, K Krug, F Petralia, Y Li, WW Liang…, Year: 2020, Source: https://www.cell.com/cell/fulltext/S0092-8674(20)30744-3 | Title: An energy-efficient and bandwidth-scalable DWDM heterogeneous silicon photonics integration platform, Authors: D Liang, S Srinivasan, G Kurczveil…, Year: 2022, Source: https://ieeexplore.ieee.org/abstract/document/9794616/ | Title: Oncogenic signaling pathways in the cancer genome atlas, Authors: …, D Chakravarty, F Daian, Q Gao, MH Bailey, WW Liang…, Year: 2018, Source: https://www.cell.com/cell/fulltext/S0092-8674(18)30359-3?dgcid=STMJ_1522958526_SC | Title: Incidence of left atrial appendage triggers in patients with atrial fibrillation undergoing catheter ablation, Authors: M Al Rawahi, JJ Liang, S Kapa, A Lin, Y Shirai…, Year: 2020, Source: https://www.jacc.org/doi/abs/10.1016/j.jacep.2019.08.012 | Title: Single-trait and multi-trait genome-wide association analyses identify novel loci for blood pressure in African-ancestry populations, Authors: J Liang, TH Le, DRV Edwards, BO Tayo…, Year: 2017, Source: https://journals.plos.org/plosgenetics/article?id=10.1371/journal.pgen.1006728 | Title: IPC, Authors: D Liang, D Dagenais, G Bosco, M Brodsky, Year: 2020, Source: https://ieee-ipc.org/wp-content/uploads/sites/7/2024/01/IPC-2023_Full-Program.pdf | Title: Imaging poly (ADP-ribose) polymerase-1 (PARP1) in vivo with 18F-labeled brain penetrant positron emission tomography (PET) ligand, Authors: …, DM Schuster, A Levey, L Wang, G Corfas, SH Liang, Year: 2024, Source: https://chemrxiv.org/engage/chemrxiv/article-details/65c3b62366c1381729295301 | Title: IPC, Authors: W Zhou, C Lim, D Dagenais, D Liang, Year: None, Source: https://ieee-ipc.org/wp-content/uploads/sites/7/2021/11/IPC-2021-Full-Program-for-website-Danielle-Corrigan.pdf | Title: MMA: Multi-Metric-Autoencoder for Analyzing High-Dimensional and Incomplete Data, Authors: C Liang, D Wu, Y He, T Huang, Z Chen…, Year: 2023, Source: https://link.springer.com/chapter/10.1007/978-3-031-43424-2_1"
